{
  "entry": "webgpu-apple-m5-pro-macos26-chrome152-sg32-burst4-flush32",
  "family": "qwen3-8b-q4f16-1",
  "runtimeJs": [
    {
      "name": "web-llm-0.2.84-qwen-m5-overlap.js",
      "url": "https://huggingface.co/datasets/ozhyhinas/webnn-catalog/resolve/170ebdf3b1707f939833511cf1d295305227c921/qwen3-1.7b-q4f16-1/v1/webgpu-apple-m5-pro-macos26-chrome152-sg32-burst4-flush32/web-llm-0.2.84-qwen-m5-overlap.js",
      "bytes": 6593519,
      "sha256": "d36ca3f7560c51b54c8574f0f0df6346738584df14ada37fb3f1c12d10067ccc",
      "mediaType": "text/javascript",
      "role": "Hash-verified WebLLM ESM runtime with K-step decode and WebGPU runtime-overlap flags; reused without duplication from the 1.7B catalog artifact"
    }
  ],
  "modelWasm": [
    {
      "name": "qwen3-8b-argmax-chunk256-sg32-tr32.wasm",
      "url": "https://huggingface.co/datasets/ozhyhinas/webnn-catalog/resolve/baf469ccf9a29720282d6bee0c9d743436cdc9af/qwen3-8b-q4f16-1/v1/webgpu-apple-m5-pro-macos26-chrome152-sg32-burst4-flush32/qwen3-8b-argmax-chunk256-sg32-tr32.wasm",
      "bytes": 5880146,
      "sha256": "6318212f6c296a049236d2ca9653298d5e2997bbf1566a39e9e4b374fb5d1214",
      "mediaType": "application/wasm",
      "role": "Qwen3-8B model library with subgroup-32, chunk-256 argmax and GEMV TR=32"
    }
  ],
  "modelResources": [
    {
      "name": "mlc-ai/Qwen3-8B-q4f16_1-MLC snapshot",
      "url": "https://huggingface.co/mlc-ai/Qwen3-8B-q4f16_1-MLC/resolve/b3d55c289eae58f77095f5b68c895eeea358ee09/",
      "repository": "mlc-ai/Qwen3-8B-q4f16_1-MLC",
      "revision": "b3d55c289eae58f77095f5b68c895eeea358ee09",
      "bytes": 4623997938,
      "license": "Apache-2.0",
      "mediaType": "application/vnd.huggingface.repository",
      "role": "Immutable upstream weights, tokenizer and MLC chat configuration"
    }
  ],
  "notes": "The existing runtime JS is reused by immutable URL and hash rather than uploaded again. The new model WASM and multi-file upstream model repository are independently revision-pinned and byte-hashed where applicable."
}
