{
  "entry": "webgpu-apple-m5-pro-macos26-chrome152-sg32-burst5-flush32",
  "family": "qwen3.5-0.8b-q4f16-1",
  "runtimeJs": [
    {
      "name": "web-llm-0.2.84-qwen-m5-lookahead.js",
      "url": "https://huggingface.co/datasets/ozhyhinas/webnn-catalog/resolve/2efcfd5804a39bc2c1af40389e16d8a0a4e73d4a/qwen3-1.7b-q4f16-1/webgpu-apple-m5-pro-macos26-chrome152-sg32-burst1-flush32-lookahead1/web-llm-0.2.84-qwen-m5-lookahead.js",
      "bytes": 6598408,
      "sha256": "163177f1c2842ca60a52644109867c48e7ee6865530149a69ac3fd827d4cce35",
      "mediaType": "text/javascript",
      "role": "Hash-verified WebLLM ESM runtime with K-step decode, WebGPU runtime-overlap flags, and GPU lookahead; reused without duplication from the 1.7B catalog artifact. Lookahead is disabled for this entry (runtime.config.lookahead=0); it was measured for this model and not adopted (1.032x, IQR crossing parity)."
    }
  ],
  "modelWasm": [
    {
      "name": "qwen3.5-0.8b-argmax-chunk256-sg32.wasm",
      "url": "https://huggingface.co/datasets/ozhyhinas/webnn-catalog/resolve/7c1591a3d2f4d4929f4d7afd6f07a17d598e15cf/qwen3.5-0.8b-q4f16-1/v1/webgpu-apple-m5-pro-macos26-chrome152-sg32-burst5-flush32/qwen3.5-0.8b-argmax-chunk256-sg32.wasm",
      "bytes": 6229140,
      "sha256": "aea2152ea7783c0e80c5e1cf9004e69e70a8365acdfc1aea1a2eb7715b013987",
      "mediaType": "application/wasm",
      "role": "Qwen3.5-0.8B model library with subgroup-32 and chunk-256 two-stage full-vocabulary GPU argmax. WebGPU GEMV TR is a no-op for this model (byte-identical compiled output at every TR value), so no TR is named in the filename."
    }
  ],
  "modelResources": [
    {
      "name": "mlc-ai/Qwen3.5-0.8B-q4f16_1-MLC snapshot",
      "url": "https://huggingface.co/mlc-ai/Qwen3.5-0.8B-q4f16_1-MLC/resolve/0ec138972555613c1d7812a821778ad0398c8790/",
      "repository": "mlc-ai/Qwen3.5-0.8B-q4f16_1-MLC",
      "revision": "0ec138972555613c1d7812a821778ad0398c8790",
      "bytes": 447177073,
      "license": "Apache-2.0",
      "mediaType": "application/vnd.huggingface.repository",
      "role": "Immutable upstream weights, tokenizer and MLC chat configuration"
    }
  ],
  "notes": "The runtime JS is reused by immutable URL and hash rather than uploaded again: it is byte-identical to the bundle already published for the Qwen3-1.7B lookahead entry (confirmed by SHA-256 before reuse). The new model WASM and multi-file upstream model repository are independently revision-pinned and byte-hashed where applicable."
}
