{
  "entry": "webgpu-apple-m5-pro-macos26-chrome152-sg32-burst4",
  "family": "qwen3-0.6b-q4f16-1",
  "runtimeJs": [
    {
      "name": "web-llm-0.2.84-qwen-m5.js",
      "url": "https://huggingface.co/datasets/ozhyhinas/webnn-catalog/resolve/main/qwen3-0.6b-q4f16-1/webgpu-apple-m5-pro-macos26-chrome152-sg32-burst4/web-llm-0.2.84-qwen-m5.js",
      "bytes": 6596217,
      "sha256": "483b1aba31e7ef6a3f4e4ef70499c92c03ff9eadfbeef1faabbf523a3a83a27a",
      "mediaType": "text/javascript",
      "role": "Hash-verified WebLLM ESM runtime"
    }
  ],
  "modelWasm": [
    {
      "name": "qwen3-0.6b-argmax-chunk256-sg32-tr32.wasm",
      "url": "https://huggingface.co/datasets/ozhyhinas/webnn-catalog/resolve/main/qwen3-0.6b-q4f16-1/webgpu-apple-m5-pro-macos26-chrome152-sg32-burst4/qwen3-0.6b-argmax-chunk256-sg32-tr32.wasm",
      "bytes": 5554131,
      "sha256": "89477de312adc7f8827e5b5b6e9bfb122ff53558a3cd605e493c820d5f1fe20e",
      "mediaType": "application/wasm",
      "role": "Qwen model library with subgroup-32, chunk-256 argmax and GEMV TR=32"
    }
  ],
  "modelResources": [
    {
      "name": "mlc-ai/Qwen3-0.6B-q4f16_1-MLC snapshot",
      "url": "https://huggingface.co/mlc-ai/Qwen3-0.6B-q4f16_1-MLC/resolve/8c14ce481d4c692769976ad52afea453a102df19/",
      "repository": "mlc-ai/Qwen3-0.6B-q4f16_1-MLC",
      "revision": "8c14ce481d4c692769976ad52afea453a102df19",
      "bytes": 346794942,
      "license": "Apache-2.0",
      "mediaType": "application/vnd.huggingface.repository",
      "role": "Immutable upstream weights, tokenizer and MLC chat configuration"
    }
  ],
  "notes": "Runtime JS and model WASM use byte-level SHA-256. The multi-file model repository is pinned by its immutable Hugging Face revision."
}
