{
  "entry": "webgpu-apple-m5-pro-macos26-chrome152-sg32-burst4-flush64",
  "family": "qwen3.5-9b-q4f16-1",
  "runtimeJs": [
    {
      "name": "web-llm-0.2.84-qwen-m5-lookahead.js",
      "url": "https://huggingface.co/datasets/ozhyhinas/webnn-catalog/resolve/2efcfd5804a39bc2c1af40389e16d8a0a4e73d4a/qwen3-1.7b-q4f16-1/webgpu-apple-m5-pro-macos26-chrome152-sg32-burst1-flush32-lookahead1/web-llm-0.2.84-qwen-m5-lookahead.js",
      "bytes": 6598408,
      "sha256": "163177f1c2842ca60a52644109867c48e7ee6865530149a69ac3fd827d4cce35",
      "mediaType": "text/javascript",
      "role": "Hash-verified WebLLM ESM runtime with K-step decode and WebGPU runtime-overlap flags; reused without duplication from the 1.7B lookahead-pass catalog artifact. This roll runs it with lookahead 0 (rejected for 9B, see provenance.md)."
    }
  ],
  "modelWasm": [
    {
      "name": "qwen35-9b-argmax-chunk256-sg32-tr64.wasm",
      "url": "https://huggingface.co/datasets/ozhyhinas/webnn-catalog/resolve/fc32c4e155199175e14e2fd3888c6fc2f54d0f71/qwen3.5-9b-q4f16-1/v1/webgpu-apple-m5-pro-macos26-chrome152-sg32-burst4-flush64/qwen35-9b-argmax-chunk256-sg32-tr64.wasm",
      "bytes": 6560135,
      "sha256": "b3e5395b14bf8b84edf2d7dec431759e98216c864cd3f24197251e0fce0508a3",
      "mediaType": "application/wasm",
      "role": "Qwen3.5-9B model library with subgroup-32, chunk-256 full-vocabulary GPU argmax (compiler default; TVM_WEBGPU_GEMV_TR is a verified no-op for this model, so no TR value is claimed as a tuning choice)"
    }
  ],
  "modelResources": [
    {
      "name": "mlc-ai/Qwen3.5-9B-q4f16_1-MLC snapshot",
      "url": "https://huggingface.co/mlc-ai/Qwen3.5-9B-q4f16_1-MLC/resolve/c7c5d3f5a81e37b8facbb72970940a1b131314a8/",
      "repository": "mlc-ai/Qwen3.5-9B-q4f16_1-MLC",
      "revision": "c7c5d3f5a81e37b8facbb72970940a1b131314a8",
      "bytes": 5061443935,
      "license": "Apache-2.0",
      "mediaType": "application/vnd.huggingface.repository",
      "role": "Immutable upstream weights, tokenizer and MLC chat configuration"
    }
  ],
  "notes": "The existing runtime JS is reused by immutable URL and hash rather than uploaded again. The new model WASM is uploaded to this entry's own path and revision-pinned once published; the multi-file upstream model repository is independently revision-pinned. modelResources.bytes is the total size of all 135 files in the pinned upstream revision (per the Hugging Face tree API); only metadata/tokenizer files were downloaded locally to compile against, the weight shards were not duplicated in this worktree."
}
