{
  "entry": "webgpu-apple-m5-pro-macos26-chrome152-burst1-flush32-lookahead1",
  "family": "minicpm5-2b-q4f16-1",
  "runtimeJs": [
    {
      "name": "web-llm-0.2.84-qwen-m5-lookahead.js",
      "url": "https://huggingface.co/datasets/ozhyhinas/webnn-catalog/resolve/2efcfd5804a39bc2c1af40389e16d8a0a4e73d4a/qwen3-1.7b-q4f16-1/webgpu-apple-m5-pro-macos26-chrome152-sg32-burst1-flush32-lookahead1/web-llm-0.2.84-qwen-m5-lookahead.js",
      "bytes": 6598408,
      "sha256": "163177f1c2842ca60a52644109867c48e7ee6865530149a69ac3fd827d4cce35",
      "mediaType": "text/javascript",
      "role": "Hash-verified WebLLM ESM runtime with K-step decode, WebGPU runtime-overlap flags and the greedy lookahead pipeline; reused without duplication from the 1.7B lookahead catalog artifact"
    }
  ],
  "modelWasm": [
    {
      "name": "minicpm5-2b-argmax-chunk256-nosg-tr64.wasm",
      "url": "https://huggingface.co/datasets/ozhyhinas/webnn-catalog/resolve/3ee998cdd86fd43ac417edebab9b16aaba03e700/minicpm5-2b-q4f16-1/v1/webgpu-apple-m5-pro-macos26-chrome152-burst1-flush32-lookahead1/minicpm5-2b-argmax-chunk256-nosg-tr64.wasm",
      "bytes": 6562687,
      "sha256": "addcdc0a97cd186d7e500bc90af5caf6cd73609bcef9579ef43f862ed48363ff",
      "mediaType": "application/wasm",
      "role": "MiniCPM5-2B model library, chunk-256 two-stage GPU argmax, no WebGPU subgroups, GEMV TR=64 (TVM default)"
    }
  ],
  "modelResources": [
    {
      "name": "ozhyhinas/MiniCPM5-2B-q4f16_1-MLC snapshot",
      "url": "https://huggingface.co/ozhyhinas/MiniCPM5-2B-q4f16_1-MLC/resolve/2318f37d9c39277ff01dc64086491028c95d4db4/",
      "repository": "ozhyhinas/MiniCPM5-2B-q4f16_1-MLC",
      "revision": "2318f37d9c39277ff01dc64086491028c95d4db4",
      "bytes": 1432663420,
      "license": "Apache-2.0",
      "mediaType": "application/vnd.huggingface.repository",
      "role": "Immutable upstream weights, tokenizer, MLC chat configuration, and the published (stock, self-compiled) model library this entry is measured against"
    }
  ],
  "notes": "The runtime JS is reused by immutable URL and hash from the 1.7B lookahead catalog entry rather than uploaded again. The new model WASM is this entry's tuned library, uploaded independently of the upstream model repository (whose own bundled library is the published baseline this entry's measurements compare against, not this artifact)."
}
