{
  "entry": "webgpu-apple-m5-pro-macos26-chrome152-sg32-burst1-lookahead1",
  "family": "qwen3.5-4b-q4f16-1",
  "runtimeJs": [
    {
      "name": "web-llm-0.2.84-qwen-m5-lookahead.js",
      "url": "https://huggingface.co/datasets/ozhyhinas/webnn-catalog/resolve/2efcfd5804a39bc2c1af40389e16d8a0a4e73d4a/qwen3-1.7b-q4f16-1/webgpu-apple-m5-pro-macos26-chrome152-sg32-burst1-flush32-lookahead1/web-llm-0.2.84-qwen-m5-lookahead.js",
      "bytes": 6598408,
      "sha256": "163177f1c2842ca60a52644109867c48e7ee6865530149a69ac3fd827d4cce35",
      "mediaType": "text/javascript",
      "role": "Hash-verified WebLLM ESM runtime with K-step decode, WebGPU runtime-overlap flags and the greedy lookahead pipeline; reused without duplication from the 1.7B lookahead catalog artifact"
    }
  ],
  "modelWasm": [
    {
      "name": "qwen35-4b-argmax-chunk256-sg32-tr32.wasm",
      "url": "https://huggingface.co/datasets/ozhyhinas/webnn-catalog/resolve/24bc4549e529d7e7c159d29c6415fc6f50663af4/qwen3.5-4b-q4f16-1/v1/webgpu-apple-m5-pro-macos26-chrome152-sg32-burst1-lookahead1/qwen35-4b-argmax-chunk256-sg32-tr32.wasm",
      "bytes": 6534052,
      "sha256": "5b13f1de06bb205b87ccbcdd565859fc9ef4cb39f1cee161149f3dc956b20829",
      "mediaType": "application/wasm",
      "role": "Qwen3.5-4B model library with subgroup-32 and chunk-256 two-stage full-vocabulary GPU argmax. WebGPU GEMV TR is a no-op for this model (byte-identical compiled output at every TR value 16/32/64/128), so no TR is functionally distinguished; the filename keeps its build-time -tr32 label for traceability."
    }
  ],
  "modelResources": [
    {
      "name": "mlc-ai/Qwen3.5-4B-q4f16_1-MLC snapshot",
      "url": "https://huggingface.co/mlc-ai/Qwen3.5-4B-q4f16_1-MLC/resolve/44b42469f9e192814bfd90440e3b377d89ba7a13/",
      "repository": "mlc-ai/Qwen3.5-4B-q4f16_1-MLC",
      "revision": "44b42469f9e192814bfd90440e3b377d89ba7a13",
      "bytes": 2390497405,
      "license": "Apache-2.0",
      "mediaType": "application/vnd.huggingface.repository",
      "role": "Immutable upstream weights, tokenizer and MLC chat configuration"
    }
  ],
  "notes": "The runtime JS is reused by immutable URL and hash rather than uploaded again: it is byte-identical to the bundle already published for the Qwen3-1.7B lookahead entry (confirmed by SHA-256 before reuse). The model WASM is new for this entry and uploaded to the ozhyhinas/webnn-catalog Hugging Face dataset at the pinned revision recorded once publish-weights.sh has run; the upstream model repository is independently revision-pinned and byte-counted."
}
